{
  "$schema": "https://json-schema.org/draft/2020-12/schema",
  "title": "Fleet target manifest",
  "description": "Structural contract for one approved fleet target manifest. scripts/validate_fleet_manifest.py is the stronger check and is authoritative. It also enforces what a schema cannot: expiry against the clock, a window end after its start, each target window inside authority.change_window, unique hostnames and device identifiers, target count within max_hosts, and a separate approver for R4 and R5 targets. A manifest whose authority.status is revoked is refused by both and is therefore not listed in the status enumeration. tests/python/test_fleet_manifest_schema.py keeps the two in agreement.",
  "type": "object",
  "required": [
    "schema_version",
    "manifest_id",
    "environment",
    "tenant",
    "approved_by",
    "authority",
    "expires_at",
    "max_hosts",
    "targets"
  ],
  "properties": {
    "schema_version": {
      "const": "1.0"
    },
    "manifest_id": {
      "type": "string",
      "minLength": 8,
      "pattern": "\\S"
    },
    "environment": {
      "type": "string",
      "pattern": "\\S"
    },
    "tenant": {
      "type": [
        "string",
        "null"
      ],
      "pattern": "\\S"
    },
    "approved_by": {
      "type": "string",
      "pattern": "\\S"
    },
    "authority": {
      "type": "object",
      "required": [
        "owner",
        "approver",
        "change_window",
        "status"
      ],
      "properties": {
        "owner": {
          "type": "string",
          "pattern": "\\S"
        },
        "approver": {
          "type": "string",
          "pattern": "\\S"
        },
        "change_window": {
          "type": "string",
          "pattern": "^\\d{4}-\\d{2}-\\d{2}T\\d{2}:\\d{2}(?::\\d{2}(?:\\.\\d+)?)?(?:Z|[+-]\\d{2}:\\d{2})/\\d{4}-\\d{2}-\\d{2}T\\d{2}:\\d{2}(?::\\d{2}(?:\\.\\d+)?)?(?:Z|[+-]\\d{2}:\\d{2})$"
        },
        "status": {
          "enum": [
            "synthetic-test-only",
            "approved"
          ]
        }
      }
    },
    "expires_at": {
      "type": "string",
      "pattern": "^\\d{4}-\\d{2}-\\d{2}T\\d{2}:\\d{2}(?::\\d{2}(?:\\.\\d+)?)?(?:Z|[+-]\\d{2}:\\d{2})$"
    },
    "max_hosts": {
      "type": "integer",
      "minimum": 1
    },
    "targets": {
      "type": "array",
      "minItems": 1,
      "items": {
        "type": "object",
        "required": [
          "hostname",
          "device_id",
          "owner",
          "site",
          "platform",
          "management_plane",
          "risk_tier",
          "maintenance_window"
        ],
        "properties": {
          "hostname": {
            "type": "string",
            "pattern": "^\\s*(?!\\.+\\s*$)[^\\s*?,;/\\\\\\[\\]{}<>|]+\\s*$"
          },
          "device_id": {
            "type": "string",
            "pattern": "\\S"
          },
          "owner": {
            "type": "string",
            "pattern": "\\S"
          },
          "site": {
            "type": "string",
            "pattern": "\\S"
          },
          "platform": {
            "type": "string",
            "pattern": "\\S"
          },
          "management_plane": {
            "type": "string",
            "pattern": "\\S"
          },
          "risk_tier": {
            "enum": [
              "R0",
              "R1",
              "R2",
              "R3",
              "R4",
              "R5"
            ]
          },
          "maintenance_window": {
            "type": "string",
            "pattern": "^\\d{4}-\\d{2}-\\d{2}T\\d{2}:\\d{2}(?::\\d{2}(?:\\.\\d+)?)?(?:Z|[+-]\\d{2}:\\d{2})/\\d{4}-\\d{2}-\\d{2}T\\d{2}:\\d{2}(?::\\d{2}(?:\\.\\d+)?)?(?:Z|[+-]\\d{2}:\\d{2})$"
          }
        }
      }
    }
  }
}
