{
  "schema_version": "1.0",
  "manifest_id": "lab-ring-0001",
  "environment": "lab",
  "tenant": null,
  "approved_by": "lab-owner",
  "authority": {
    "owner": "lab-owner",
    "approver": "lab-owner",
    "change_window": "2098-12-31T20:00:00Z/2098-12-31T21:00:00Z",
    "status": "synthetic-test-only"
  },
  "expires_at": "2099-01-01T00:00:00Z",
  "max_hosts": 2,
  "targets": []
}
